{
    "object_type": "Dokument",
    "attributes": {
        "docId": "",
        "pageId": "",
        "tsid": "",
        "imgUrl": "",
        "xmlUrl": ""
    },
    "author": {
        "forename": "",
        "familyname": "",
        "role": "",
        "associated_place": "",
        "associated_organisation": "Deutscher Sängerbund"
    },
    "recipient": {
        "forename": "",
        "familyname": "",
        "role": "",
        "associated_place": "",
        "associated_organisation": "Chöre des Deutschen Sängerbundes"
    },
    "mentioned_persons": [
        {
            "forename": "Albert",
            "familyname": "Meister",
            "role": "Bundesführer des Deutschen Sängerbundes",
            "associated_place": "Herne"
        },
        {
            "forename": "Hermann",
            "familyname": "Göring",
            "role": "Reichsmarschall",
            "associated_place": ""
        },
        {
            "forename": "Joseph",
            "familyname": "Goebbels",
            "role": "Reichsminister",
            "associated_place": ""
        },
        {
            "forename": "",
            "familyname": "Cerff",
            "role": "Leiter des NS-Volkskulturwerkes",
            "associated_place": ""
        },
        {
            "forename": "",
            "familyname": "Raabe",
            "role": "Präsident der Reichsmusikkammer",
            "associated_place": ""
        },
        {
            "forename": "",
            "familyname": "Lutze",
            "role": "Stabschef der SA",
            "associated_place": ""
        },
        {
            "forename": "",
            "familyname": "Memmel",
            "role": "Stellv. Bundesführer",
            "associated_place": "Würzburg"
        }
    ],
    "mentioned_organizations": [
        "Deutscher Sängerbund",
        "Stagma",
        "WhW",
        "DRK",
        "NS-Volkskulturwerk",
        "Reichsmusikkammer",
        "SA"
    ],
    "mentioned_events": [
        "Deutsches Sängerbundesfest 1937 in Breslau",
        "Beerdigung von Albert Meister am 23. August in Herne"
    ],
    "creation_date": "",
    "creation_place": "",
    "mentioned_dates": [
        "1937",
        "23. August"
    ],
    "mentioned_places": [
        "Breslau",
        "Herne",
        "Würzburg"
    ],
    "content_tags_in_german": [
        "Pflichtlieder",
        "Vortragsfolgen",
        "Aufführungen",
        "Heimgang",
        "Kameraden im feldgrauen Rock"
    ],
    "content_transcription": "zu Pflichtliedern für die ganze Nation erklärt werden. Es handelt sich dabei, was auch hier\nausdrücklich vermerkt werden soll, um einstimmige Lieder. Ihre Anschaffung und Einübung\nbis zum Auswendigsingen wird allen unseren Chören zur Pflicht gemacht. (Siehe Deutsche\nSängerbundes-Zeitung Heft 8 Seite 99 und 110).\n7. Einsendung von Vortragsfolgen.\nImmer wieder muß festgestellt werden, daß die Einsendung von je 4 Vortragsfolgen von jeder\nVeranstaltung unserer Chöre — auch von Lazarettsingen u. dgl. — nicht mit der Gewissen-\nhaftigkeit erfolgt, die verlangt werden muß. Ganz abgesehen davon, daß jeder säumige Chor\nsich den Ordnungsstrafen der Stagma aussetzt, soll auch hier das oft Gesagte wiederholt\nwerden, daß Nachlässigkeit in dieser Pflicht eine Undankbarkeit gegen die Komponisten\nbedeutet, denen dadurch die oft für ihren Lebensunterhalt dringend nötigen Aufführungs-\ngebühren vorenthalten werden. In künftigen Fällen können wir uns nicht mehr für solche\nChöre einsetzen, die ihre Pflicht versäumt haben und deshalb von der Stagma mit Strafen\nbelegt worden sind.\n8. Aufführungen zu Gunsten des WhW und des DRK\nDie erfreuliche Vielzahl derartiger Veranstaltungen von Seiten unserer Chöre erfüllt uns mit\nstolzer Freude. Leider wird aber von unseren Chören allzuoft versäumt, über alle diese Ver-\nanstaltungen den angeordneten kurzen Bericht wohlgemerkt neben der Einsendung der\nVortragsfolgen, die hiervon nicht berührt wird an die Sängerkreise unter Nennung der\nHöhe des finanziellen Ergebnisses zu erstatten. Wir machen deshalb unseren Chören diese\nBerichterstattung, deren werbender Zweck doch jedermann klar vor Augen stehen sollte,\nerneut zur strengen Pflicht.\n9. Heimgang des Bundesführers des DSB\nDer Bundesführer des Deutschen Sängerbundes, Oberbürgermeister Albert Meister, Herne\nist nach langem, schwerem Leiden aus dem Leben geschieden. Sein Heimgang erfüllt die\ndeutsche Sängerschaft mit tiefer Trauer. Ein begeisterter Sänger und fanatischer Kämpfer ist\nmit ihm allzufrüh dahingegangen. Höhepunkt seiner selbstlosen und aufopfernden Tätigkeit für\nunseren Bund waren die festlichen Tage des deutschen Sängerbundesfestes in Breslau 1937\nwo er den Dank und die Anerkennung des Führers für sein und des Deutschen Sängerbundes\nWirken und Streben entgegennehmen durfte. Der verewigte Bundesführer wurde am Sonntag\ndem 23. August in Herne in sehr würdiger und ergreifender Weise zur letzten Ruhe gebettet.\nKränze des Führers, des Reichsmarschalls Hermann Göring, des Reichsministers Dr. Goebbels,\ndes Leiters des NS-Volkskulturwerkes Cerff, des Präsidenten der Reichsmusikkammer\nRaabe, des Stabschefs der SA Lutze und vieler anderer gaben Zeugnis von der hohen Wert-\nschätzung, die dem Verblichenen allseits entgegengebracht wurde. Der Stellv. Bundesführer\nOberbürgermeister Memmel, Würzburg, widmete dem Entschlafenen namens des Deutschen\nSängerbundes einen tief zu Herzen gehenden Nachruf. Seine Arbeit und seine Persönlichkeit\nwerden auch in den Reihen unserer badischen Sänger in dankbarer und ehrender Erinnerung\nerhalten bleiben.\n10. Unsere Kameraden im feldgrauen Rock.\nWie wir wissen, gibt es in unserem Sängergau keinen Chor, der nicht mit seinen im Felde\nstehenden Sangeskameraden in engster und liebevoller Verbindung stände. Die Riesenzahl\nder begeisterten Dankbriefe aus dem Felde, die eine rührende Treue aller Kameraden draußen\nzu ihrer heimatlichen Chorvereinigung erkennen lassen, werden für alle Zeiten packende\nDokumente der tiefen Verbundenheit von Front und Heimat sein. Unser gegenwärtiges Rund-\nschreiben soll auch nicht geschlossen werden, ohne unserer toten Helden in stolzer Trauer\nzu gedenken und unsere tapferen Kameraden zu grüßen, die an allen Fronten ihr Leben für\ndie Heimat in die Schanze schlagen. Sie werden, wenn sie wohlbehalten aus diesem gewaltigen\nRingen zurückkehren, was wir ihnen von ganzem Herzen wünschen, die Treuesten der Treuen\nunter uns sein.",
    "document_type": "Protokoll",
    "document_format": "Maschinell"
}