{
    "document_id": "Akte_062_pdf.pdf",
    "metadata": {
        "author": {
            "forename": "",
            "familyname": "",
            "role": "Vereinsf\u00fchrer",
            "associated_place": "Murg"
        },
        "recipient": {
            "forename": "Max",
            "familyname": "Matt",
            "role": "B\u00fcrgermeister",
            "associated_place": "Herrischried"
        },
        "mentioned_persons": [
            {
                "forename": "",
                "familyname": "Burger",
                "role": "Ehrenvorsitzender",
                "associated_place": "Waldelektra"
            }
        ],
        "mentioned_organization": [
            {
                "Organization_name": "M\u00e4nnerchor Murg",
                "associated_place": "Murg"
            }
        ],
        "mentioned_events": [
            {
                "date": "",
                "description": "Sending Christmas packages to soldiers",
                "associated_place": ""
            }
        ],
        "creation_dates": [
            {
                "day": "5",
                "month": "November",
                "year": "1941"
            }
        ],
        "creation_place": [
            "Murg"
        ],
        "mentioned_dates": [
            {
                "day": "",
                "month": "Dezember",
                "year": ""
            }
        ],
        "mentioned_places": [
            "Murg",
            "Herrischried",
            "Waldelektra"
        ]
    },
    "content_tags": [
        "World War II",
        "German history",
        "M\u00e4nnerchor",
        "Christmas packages",
        "Obstschnaps"
    ],
    "content_transcription": "Murg, den 5.November 1941.\nHerrn\nMax Matt\nB\u00fcrgermeister\nHerrischried\nSehr geehrter Herr B\u00fcrgermeister !\nSie werden sich fragen, was will denn der M\u00e4nnerchor\nMurg von mir. Nun, ich m\u00f6chte Ihnen mein Anliegen\nnachstehend gleich vortragen. Es handelt sich um\nfolgendes:\nUnser Verein hat 20 S\u00e4nger im Felde stehen. Diesen\nwollen wir zu Weihnachten P\u00e4ckchen schicken. Es ist\naber heute ausserordentlich schwer, daf\u00fcr etwas auf-\nzutreiben. Recht gerne w\u00fcrden wir jedem Kameraden\nu.a. etwas Obstschnaps schicken. Im ganzen m\u00fcssten\nwir 5 ltr. haben. Aber woher nehmen ? Die Leute haben\njetzt noch nicht gebrannt und doch soll man die\nP\u00e4ckchen anfangs Dezember aufgeben.\nIch habe nun schon des \u00f6ftern geh\u00f6rt, dass Sie,Herr\nB\u00fcrgermeister,ein besonders gutes Herz und eine\noffene Hand f\u00fcr unsere Soldaten im Felde haben. Auch\nhat mir Herr Burger von der Waldelektra, der Ehren-\nvorsitzender unseres Vereins ist, schon erz\u00e4hlt, in\nwelch vorbildlicher Weise Sie als echt deutscher Mann\nSIE Ihre Pflichten dem Vaterland gegen\u00fcber erf\u00fcllen.\nDa dachte ich mir, ob Sie uns vielleicht auf Grund\nihrer Beziehungen bis Ende November/Anfang Dezember\netwa 5 1Lr. Obstschnaps verschaffen k\u00f6nnten. Ent-\nschuldigen Sie, wenn ich sie zu Ihrer Arbeit hin noch\nmit so etwas bel\u00e4stige.\nVielleicht sind sie so freundlich und geben mir bald\nBescheid. Sofern Sie meiner Bitte entsprechen k\u00f6nnen,\nsagen Sie auch gleich was es kostet, damit ich Ihnen\ndann sofort das Geld schicken kann.\n1 Freiumschlag.Heil Hitler!\nDer Vereinsf\u00fchrer:\n",
    "document_type_options": [
        "Brief"
    ],
    "document_format_options": [
        "Maschinell"
    ]
}