{
    "document_id": "Akte_042_pdf.pdf",
    "metadata": {
        "author": {
            "forename": "Karl",
            "familyname": "Schmitt",
            "role": "S\u00e4ngergauf\u00fchrer",
            "associated_place": "Karlsruhe"
        },
        "recipient": {
            "forename": "",
            "familyname": "",
            "role": "Ch\u00f6re des S\u00e4ngergaues Baden",
            "associated_place": "Baden"
        },
        "mentioned_persons": [
            {
                "forename": "Robert",
                "familyname": "M\u00fcllerleile",
                "role": "S\u00e4ngerkreisf\u00fchrer",
                "associated_place": "Offenburg, Lahr"
            },
            {
                "forename": "Max",
                "familyname": "Bohnert",
                "role": "Stellv. S\u00e4ngerkreisf\u00fchrer",
                "associated_place": "Lahr"
            },
            {
                "forename": "Hugo",
                "familyname": "Vierneisel",
                "role": "S\u00e4ngerkreisf\u00fchrer",
                "associated_place": "Lauda"
            },
            {
                "forename": "",
                "familyname": "Cerff",
                "role": "Leiter des NS-Volkskulturwerkes",
                "associated_place": ""
            },
            {
                "forename": "Albert",
                "familyname": "Meister",
                "role": "Bundesf\u00fchrer des Deutschen S\u00e4ngerbundes",
                "associated_place": "Herne"
            },
            {
                "forename": "Hermann",
                "familyname": "G\u00f6ring",
                "role": "Reichsmarschall",
                "associated_place": ""
            },
            {
                "forename": "Joseph",
                "familyname": "Goebbels",
                "role": "Reichsminister",
                "associated_place": ""
            },
            {
                "forename": "",
                "familyname": "Raabe",
                "role": "Pr\u00e4sident der Reichsmusikkammer",
                "associated_place": ""
            },
            {
                "forename": "",
                "familyname": "Lutze",
                "role": "Stabschef der SA",
                "associated_place": ""
            },
            {
                "forename": "",
                "familyname": "Memmel",
                "role": "Stellv. Bundesf\u00fchrer",
                "associated_place": "W\u00fcrzburg"
            }
        ],
        "mentioned_organization": [
            {
                "Organization_name": "Deutscher S\u00e4ngerbund",
                "associated_place": ""
            },
            {
                "Organization_name": "NS-Volkskulturwerk",
                "associated_place": ""
            },
            {
                "Organization_name": "Reichspropagandaleitung",
                "associated_place": ""
            },
            {
                "Organization_name": "Reichsmusikkammer",
                "associated_place": ""
            },
            {
                "Organization_name": "SA",
                "associated_place": ""
            },
            {
                "Organization_name": "WhW",
                "associated_place": ""
            },
            {
                "Organization_name": "DRK",
                "associated_place": ""
            }
        ],
        "mentioned_events": [
            {
                "date": "27. September 1942",
                "description": "Ordentlicher Gaus\u00e4ngertag 1942",
                "associated_place": "Karlsruhe"
            },
            {
                "date": "16. August 1942",
                "description": "Verk\u00fcndung des NS-Volkskulturwerkes",
                "associated_place": "Stra\u00dfburg"
            },
            {
                "date": "23. August 1942",
                "description": "Beerdigung von Albert Meister",
                "associated_place": "Herne"
            },
            {
                "date": "27. September 1942",
                "description": "Tag der Aufnahme in die Partei",
                "associated_place": ""
            },
            {
                "date": "4. Oktober 1942",
                "description": "Erntedankfest",
                "associated_place": ""
            },
            {
                "date": "24. und 25. Oktober 1942",
                "description": "2. Reichsstra\u00dfensammlung des WhW",
                "associated_place": ""
            }
        ],
        "creation_dates": [
            {
                "day": "12",
                "month": "September",
                "year": "1942"
            }
        ],
        "creation_place": [
            "Karlsruhe"
        ],
        "mentioned_dates": [
            {
                "day": "27",
                "month": "September",
                "year": "1942"
            },
            {
                "day": "16",
                "month": "August",
                "year": "1942"
            },
            {
                "day": "23",
                "month": "August",
                "year": "1942"
            },
            {
                "day": "4",
                "month": "October",
                "year": "1942"
            },
            {
                "day": "24",
                "month": "October",
                "year": "1942"
            },
            {
                "day": "25",
                "month": "October",
                "year": "1942"
            }
        ],
        "mentioned_places": [
            "Karlsruhe",
            "Offenburg",
            "Lahr",
            "Lauda",
            "Stra\u00dfburg",
            "Herne",
            "Breslau",
            "W\u00fcrzburg"
        ]
    },
    "content_tags": [
        "S\u00e4ngergau",
        "NS-Volkskulturwerk",
        "Deutscher S\u00e4ngerbund",
        "Weltkrieg",
        "Chor",
        "Propaganda"
    ],
    "content_transcription": "S\u00e4ngergau XV Baden im deutschen S\u00e4ngerbund (Badischer S\u00e4ngerbund e.V.)Karlsruhe, 12. September 1942. An alle Ch\u00f6re des S\u00e4ngergaues Baden. Liebe Sangeskameraden! Hierdurch werden die nachfolgenden, wichtigen Punkte \u2014 in Ermangelung unseres Gauorgans, der S\u00fcddeutschen S\u00e4ngerzeitung, die, wie bekannt, seit Juni v. J. aus kriegsbedingten Ursachen ihr Erscheinen einstellen mu\u00dfte, durch Rundschreiben bekannt gegeben. 1. Ordentlicher Gaus\u00e4ngertag 1942. Der diesj\u00e4hrige Gaus\u00e4ngertag findet am Sonntag, dem 27. September um 10.30 Uhr in Karlsruhe im Saale des \u201eFriedrichshof\" Karlfriedrich-Stra\u00dfe statt. Hierzu werden unsere Ch\u00f6re hiermit eingeladen. Die Tagesordnung ist folgende: 1. Gesch\u00e4ftsbericht des S\u00e4ngergauf\u00fchrers. 2. Bericht des S\u00e4ngergauschatzmeisters. 3. Wahl des S\u00e4ngergauf\u00fchrers, dessen Stellvertreters und zweier Rechnungspr\u00fcfer. 4. Verschiedenes; W\u00fcnsche und Anregungen. Im Hinblick auf die Einschr\u00e4nkungen im Reiseverkehr erwartet die S\u00e4ngergauf\u00fchrung vor allem die Vertreter aus den zum Tagungsort g\u00fcnstig gelegenen Pl\u00e4tzen. Auf die M\u00f6glichkeit der (schriftlichen) \u00dcbertragung des Stimmrechts auf einen anderen Mitgliedschor wird besonders aufmerksam gemacht. 2. Organisatorisches. Seit Juni v. J. haben sich innerhalb einzelner S\u00e4ngerkreisf\u00fchrungen folgende \u00c4nderungen ergeben: Der an Lebensjahren \u00e4lteste S\u00e4ngerkreisf\u00fchrer unseres S\u00e4ngergaues, Sangeskamerad Robert M\u00fcllerleile vom S\u00e4ngerkreis Offenburg in Lahr, ist gestorben. Als einem S\u00e4ngerf\u00fchrer von hervorragenden Eigenschaften des Geistes und des Herzens ist ihm bei allen, die ihn kannten und sch\u00e4tzten, ein dauerndes, ehrendes Andenken gewi\u00df. Mit Zustimmung des S\u00e4nger- gauf\u00fchrers soll von einer Neubesetzung des Postens bis Ende des Krieges abgesehen werden. Die Gesch\u00e4fte f\u00fchrt inzwischen der Stellv. S\u00e4ngerkreisf\u00fchrer, Sangeskamerad Max Bohnert, Lahr, Bergstra\u00dfe 117. Im S\u00e4ngerkreis Main-Neckar ist an Stelle des zur\u00fcckgetretenen, fr\u00fcheren S\u00e4ngerkreisf\u00fchrers- neu berufen worden: Sangeskamerad Hugo Vierneisel in Lauda. 3. NS-Volkskulturwerk. Durch den \u201eAufruf an die Volkskulturgemeinschaften\u201c in Heft 6 der Deutschen S\u00e4ngerbundes- Zeitung vom 15. 6. 42. ist der deutschen S\u00e4ngerschaft die neue, parteiamtliche Einrichtung des NS-Volkskulturwerkes in der Reichspropagandaleitung zur Kenntnis gebracht worden. Wer das Wirken und Streben des Deutschen S\u00e4ngerbundes seit seinem Bestehen kennt, und wer wei\u00df welche Zielsetzung dieser gro\u00dfe Bund singender deutscher Menschen sich immer gegeben hat, der hat mit tiefster Befriedigung die pr\u00e4chtige Verlautbarung des Leiters des NS-Volkskultur- werkes Pg. Cerff, gelesen und erkannt, da\u00df damit in sch\u00f6nster Weise das in Erf\u00fcllung geht, was alle f\u00fchrenden M\u00e4nner des Sangeslebens seit dem Umbruch und insbesondere seit dem unverge\u00dflichen Deutschen S\u00e4ngerbundesfest in Breslau 1937 ersehnt, erstrebt und er- wartet haben. Wer dar\u00fcber hinaus die Rede von Pg. Cerff bei der Verk\u00fcndung des NS- Volkskulturwerkes im Gau Baden und Elsass am 16. August in Stra\u00dfburg h\u00f6ren und sich \u00fcber die ungemein sachkundigen und warmherzigen Ausf\u00fchrungen des Redners, die mit viel- fachem, st\u00fcrmischem Beifall der zahlreichen Zuh\u00f6rer im \u00fcberf\u00fcllten gro\u00dfen Saale des S\u00e4nger- hauses bedankt wurden, freuen k\u00f6nnte, der wurde sich in der gleichen Stunde bewu\u00dft, da\u00df damit eine neue, gl\u00fcckverhei\u00dfende Epoche unserer volkskulturellen Arbeit ihren Anfang ge- nommen hat. Mit dieser erfreulichen Anerkennung unserer Arbeit, sowie dem gleichzeitig ausgesprochenen Recht auf unser Eigenleben, vor allem aber mit der Zusicherung der tat- kr\u00e4ftigen F\u00f6rderung und Unterst\u00fctzung aller unserer Bestrebungen durch die Partei erh\u00e4lt unsere Arbeit einen begl\u00fcckenden Auftrieb und eine Vertiefung ihres h\u00f6chsten Zwecks: \u201eDem Volk zu dienen mit des Liedes Weihe\u201c. Nun gilt es, sich des erwiesenen Vertrauens durch tatkr\u00e4ftigen Einsatz w\u00fcrdig zu erweisen. In allen Fragen des Zusammenwirkens mit der Partei mu\u00df es immer Grundsatz sein, da\u00df wir uns nicht erst lange bitten lassen, sondern da\u00df wir in freudiger Bereitschaft uns ungerufen der Partei zur Verf\u00fcgung stellen. Damit sind wir zugleich im besten Sinne Wahrer der stolzen Tradition des Deutschen S\u00e4ngerbundes. Praktisch sieht die Sache so aus: Vereinsf\u00fchrer oder Chorleiter oder beide setzen sich in jedem einzelnen Falle mit dem \u00f6rtlichen Kulturstellenleiter wegen der Feiergestaltung m\u00f6g- lichst fr\u00fchzeitig ins Benehmen, um die erforderlichen Vorbereitungen rechtzeitig beginnen zu k\u00f6nnen. Da die Parteidienststellen ja \u00fcber das NS-Volkskulturwerk genauestens unterrichtet sind, wird ein harmonisches Zusammenarbeiten gewi\u00df immer zu erzielen sein. Und wenn sich die Dinge erst einmal eingespielt haben, dann d\u00fcrfen wir sicher sein, da\u00df sie bei beiden Teilen nur gr\u00f6\u00dfte Befriedigung ausl\u00f6sen werden. 4. Tag der Aufnahme in die Partei am 27. 9. 42. und Erntedankfest am 4. 10.42. Die n\u00e4chsten Gelegenheiten, sich in obigem Sinne zu bet\u00e4tigen, sind diese beiden Tage, bei denen \u00fcberall, wo unsere Ch\u00f6re noch singf\u00e4hig sind, ihre Mitwirkung erwartet wird. 5. Liedwerbung im Rahmen der 2. Reichsstra\u00dfensammlung des WhW am 24. und 25. 10.d.J. Ganz besonders aber wird von unseren Ch\u00f6ren freudwilliger Einsatz verlangt und erwartet bei dieser gro\u00dfen Liedwerbung, bei der unsere Ch\u00f6re als Kerntrupp bei den einstimmigen Weisen und als Darbieter mehrstimmiger S\u00e4tze ihre ganze Kraft f\u00fcr das Gelingen der uns in besonderem Ma\u00dfe angehenden Aktion einsetzen m\u00fcssen. Die Anweisungen, wie sie in der Deutschen S\u00e4ngerbundeszeitung Heft 8 vom 15. August d. J. Seite 98/99 gegeben und weiter f\u00fcr Heft 9 in Aussicht gestellt sind, wollen von allen unseren Ch\u00f6ren sinngem\u00e4\u00df angewandt werden. Dies alles in engstem Einvernehmen mit den \u00f6rtlichen Parteidienststellen (Ortskultur- stellenleitern). Damit stellen wir unsere freudige Bereitschaft, im Geiste des NS-Volkskultur- werkes wirken zu wollen, am besten unter Beweis. 6. Unser Lied: Gemeingut aller Deutschen. In genau der gleichen Richtung geht die Anordnung des Leiters des Hauptkulturamtes der NSDAP. Pg. Cerff: durch die die vier Lieder \u201eSiehst du im Osten das Morgenrot\u201c, \u201eAuf hebt unsre Fahnen\u201c, \u201eNur der Freiheit geh\u00f6rt unser Leben\u201c, \u201eVorw\u00e4rts nach Osten\u201c (Ru\u00dflandlied) zu Pflichtliedern f\u00fcr die ganze Nation erkl\u00e4rt werden. Es handelt sich dabei, was auch hier ausdr\u00fccklich vermerkt werden soll, um einstimmige Lieder. Ihre Anschaffung und Ein\u00fcbung bis zum Auswendigsingen wird allen unseren Ch\u00f6ren zur Pflicht gemacht. (Siehe Deutsche S\u00e4ngerbundes-Zeitung Heft 8 Seite 99 und 110). 7. Einsendung von Vortragsfolgen. Immer wieder mu\u00df festgestellt werden, da\u00df die Einsendung von je 4 Vortragsfolgen von jeder Veranstaltung unserer Ch\u00f6re \u2014 auch von Lazarettsingen u. dgl. \u2014 nicht mit der Gewissen- haftigkeit erfolgt, die verlangt werden mu\u00df. Ganz abgesehen davon, da\u00df jeder s\u00e4umige Chor sich den Ordnungsstrafen der Stagma aussetzt, soll auch hier das oft Gesagte wiederholt werden, da\u00df Nachl\u00e4ssigkeit in dieser Pflicht eine Undankbarkeit gegen die Komponisten bedeutet, denen dadurch die oft f\u00fcr ihren Lebensunterhalt dringend n\u00f6tigen Auff\u00fchrungs- geb\u00fchren vorenthalten werden. In k\u00fcnftigen F\u00e4llen k\u00f6nnen wir uns nicht mehr f\u00fcr solche Ch\u00f6re einsetzen, die ihre Pflicht vers\u00e4umt haben und deshalb von der Stagma mit Strafen belegt worden sind. 8. Auff\u00fchrungen zu Gunsten des WhW und des DRK Die erfreuliche Vielzahl derartiger Veranstaltungen von Seiten unserer Ch\u00f6re erf\u00fcllt uns mit stolzer Freude. Leider wird aber von unseren Ch\u00f6ren allzuoft vers\u00e4umt, \u00fcber alle diese Ver- anstaltungen den angeordneten kurzen Bericht wohlgemerkt neben der Einsendung der Vortragsfolgen, die hiervon nicht ber\u00fchrt wird an die S\u00e4ngerkreise unter Nennung der H\u00f6he des finanziellen Ergebnisses zu erstatten. Wir machen deshalb unseren Ch\u00f6ren diese Berichterstattung, deren werbender Zweck doch jedermann klar vor Augen stehen sollte, erneut zur strengen Pflicht. 9. Heimgang des Bundesf\u00fchrers des DSB Der Bundesf\u00fchrer des Deutschen S\u00e4ngerbundes, Oberb\u00fcrgermeister Albert Meister, Herne ist nach langem, schwerem Leiden aus dem Leben geschieden. Sein Heimgang erf\u00fcllt die deutsche S\u00e4ngerschaft mit tiefer Trauer. Ein begeisterter S\u00e4nger und fanatischer K\u00e4mpfer ist mit ihm allzufr\u00fch dahingegangen. H\u00f6hepunkt seiner selbstlosen und aufopfernden T\u00e4tigkeit f\u00fcr unseren Bund waren die festlichen Tage des deutschen S\u00e4ngerbundesfestes in Breslau 1937 wo er den Dank und die Anerkennung des F\u00fchrers f\u00fcr sein und des Deutschen S\u00e4ngerbundes Wirken und Streben entgegennehmen durfte. Der verewigte Bundesf\u00fchrer wurde am Sonntag dem 23. August in Herne in sehr w\u00fcrdiger und ergreifender Weise zur letzten Ruhe gebettet. Kr\u00e4nze des F\u00fchrers, des Reichsmarschalls Hermann G\u00f6ring, des Reichsministers Dr. Goebbels, des Leiters des NS-Volkskulturwerkes Cerff, des Pr\u00e4sidenten der Reichsmusikkammer Raabe, des Stabschefs der SA Lutze und vieler anderer gaben Zeugnis von der hohen Wert- sch\u00e4tzung, die dem Verblichenen allseits entgegengebracht wurde. Der Stellv. Bundesf\u00fchrer Oberb\u00fcrgermeister Memmel, W\u00fcrzburg, widmete dem Entschlafenen namens des Deutschen S\u00e4ngerbundes einen tief zu Herzen gehenden Nachruf. Seine Arbeit und seine Pers\u00f6nlichkeit werden auch in den Reihen unserer badischen S\u00e4nger in dankbarer und ehrender Erinnerung erhalten bleiben. 10. Unsere Kameraden im feldgrauen Rock. Wie wir wissen, gibt es in unserem S\u00e4ngergau keinen Chor, der nicht mit seinen im Felde stehenden Sangeskameraden in engster und liebevoller Verbindung st\u00e4nde. Die Riesenzahl der begeisterten Dankbriefe aus dem Felde, die eine r\u00fchrende Treue aller Kameraden drau\u00dfen zu ihrer heimatlichen Chorvereinigung erkennen lassen, werden f\u00fcr alle Zeiten packende Dokumente der tiefen Verbundenheit von Front und Heimat sein. Unser gegenw\u00e4rtiges Rund- schreiben soll auch nicht geschlossen werden, ohne unserer toten Helden in stolzer Trauer zu gedenken und unsere tapferen Kameraden zu gr\u00fc\u00dfen, die an allen Fronten ihr Leben f\u00fcr die Heimat in die Schanze schlagen. Sie werden, wenn sie wohlbehalten aus diesem gewaltigen Ringen zur\u00fcckkehren, was wir ihnen von ganzem Herzen w\u00fcnschen, die Treuesten der Treuen unter uns sein. Bis dahin aber wollen wir in der Heimat, \u00fcberall wo man uns braucht, bis zuletzt unsere Pflicht tun im Beruf, f\u00fcr das allgemeine Wohl und als deutsche S\u00e4nger in der Front der Heimat, die nie wichtiger war als gerade jetzt, wo es gilt, alle Herzen stark zu erhalten bis zum Endsieg, der uns sicher ist dank unserer unvergleichlichen Wehrmacht und der genialen F\u00fchrung unseres gro\u00dfen F\u00fchrers. Mit deutschem Sangesgru\u00df. Heil Hitler ! Karl Schmitt S\u00e4ngergauf\u00fchrer.",
    "document_type_options": [
        "Brief"
    ],
    "document_format_options": [
        "Maschinell",
        "mitUnterschrift"
    ]
}