{
    "author": {
        "forename": "Carl",
        "familyname": "",
        "role": "",
        "associated_place": "Herrischried",
        "associated_organisation": ""
    },
    "recipient": {
        "forename": "Alfons",
        "familyname": "",
        "role": "",
        "associated_place": "",
        "associated_organisation": ""
    },
    "mentioned_persons": [],
    "mentioned_organizations": [],
    "mentioned_events": [],
    "creation_date": "1941.12.12",
    "creation_place": "Herrischried",
    "mentioned_dates": [],
    "mentioned_places": [
        "Herrischried"
    ],
    "content_tags_in_german": [
        "Entschuldigung",
        "Zahltag",
        "Monatsanfang"
    ],
    "content_transcription": "Herrischried,den 12.Dezemb.41\nMein lieber Alfons!\nSoeben lese ich Deinen Brief nochmals und\nfinde, dass ich mich leider geiirt habe, die\nNoten machen M.7.95 während ich nur M.7.50\nüberwiesen habe.Den Restbetrag anbei in\nMarken und bitte um Entschuldigung.\nUm Dich vor Überraschungen befreit zu\nwissen muss ich Dir mitteilen,dass ich\nimmer vom 1. bis 1o.eines jeden Monats\nin Herrischried sein m u s s,wegen dem\nZahltag.Die Monteuere von auswärts müssen\nabrechnen. Natürlich kommt es darauf an\nauf welchen Tag der Erste fällt, es kann\nauch einmal früher sein, dass ich gehen\nkann.Die Verhältnisse liegen eben einmal\nso. Es tut mir sehr leid aber die Verhält-\nnisse sind eben stärker als mein Wille.\nNun sei recht herzl.gegrüsst\nDein\nCarl",
    "document_type": "Brief",
    "document_format": "Handschrift"
}