{
    "page_id": "Akte_002.11_S003",
    "metadata": {
        "author": {
            "forename": "",
            "familyname": "Durst",
            "role": "Sangesbruder",
            "position": "Gfr."
        },
        "recipient": {
            "forename": "",
            "familyname": "",
            "role": "",
            "position": ""
        },
        "mentioned_persons": [
            {
                "forename": "",
                "familyname": "",
                "role": "Sangesbr\u00fcder",
                "position": ""
            }
        ],
        "named_entities": [
            {
                "type": "organization",
                "name": "M\u00e4nnerchor"
            },
            {
                "type": "location",
                "name": "Deutschland"
            },
            {
                "type": "location",
                "name": "Murg"
            },
            {
                "type": "location",
                "name": "Russland"
            }
        ],
        "events": [
            {
                "date": "29.12.43",
                "description": "Reception of a letter"
            }
        ],
        "dates": [
            {
                "day": "3",
                "month": "3",
                "year": "1944"
            }
        ],
        "places_mentioned": [
            "Deutschland",
            "Murg",
            "Russland"
        ],
        "summary": {
            "german": "Ein Brief von Sangesbruder Durst, der \u00fcber die Schwierigkeiten des Krieges und die Bedeutung des M\u00e4nnerchors spricht.",
            "english": "A letter from Sangesbruder Durst discussing the hardships of war and the significance of the M\u00e4nnerchor."
        },
        "content_tags": [
            "Krieg",
            "M\u00e4nnerchor",
            "Brief"
        ],
        "content_transcription": "Liebe S\u00e4nger! Kameraden kann ich nicht schreiben, denn bei uns sagt man, Kameraden sind Lumpen, und das seit [sic] Ihr nicht. Also, Euren Brief vom 29.12.43 habe ich dieser Tage dankend erhalten. Das Schreiben hat ja allerhand km hinter sich. Ich w\u00e4re froh, so (ungest\u00f6rt nach?) Deutschland schaukeln zu k\u00f6nnen, wie solch ein Brief, aber mich w\u00fcrde man am Nacken festhalten wie eine Katze. Die Zeilen haben mich bei guter Gesundheit angetroffen, das N\u00e4chste, was man sich heute noch w\u00fcnschen kann. Mit tiefem Bedauern las ich vom Ableben der im Briefe erw\u00e4hnten Sangesbr\u00fcder. Es w\u00e4re h\u00f6chste Zeit, dass dieser unselige Krieg ein Ende finden w\u00fcrde. Nicht nur an der Front, sondern auch in der Heimat hinterl\u00e4sst er seine traurigen Spuren. Erst in dieser Zeit lernt man sein armseliges Leben sch\u00e4tzen, welches im Frieden so viel des Sch\u00f6nen bietet. Hoffen wir alle das Beste. Ein erfreuliches Zeichen ist es, dass der M\u00e4nnerchor trotz der Schwere der Zeit sein aktives Singen wieder aufgenommen hat. Offenbar sagten sich die Vereinsmitglieder, dass Jassen und Zegespielen dem \u201eDeutschen Liede\u201c nicht sehr f\u00f6rderlich w\u00e4re. Eine durchaus vern\u00fcnftige Ansicht. Ich selber w\u00fcrde auch viel lieber in Murg ersten Bass singen, als hier in Russland die L\u00e4use und Iwans abschrecken(?). Aber - dar\u00fcber zu bestimmen liegt leider nicht bei mir. Na, einmal h\u00f6rt auch der Krieg auf. So nun denke ich aufh\u00f6ren zu m\u00fcssen, denn meine Weisheit ist ziemlich begrenzt. Euch allen alles gute w\u00fcnschend gr\u00fcsst alle herzlich euer Sangesbruder Durst Gfr. 15605",
        "document_type_options": [
            "Brief"
        ]
    }
}