{
    "page_id": "Akte_074_S001",
    "metadata": {
        "author": {
            "forename": "",
            "familyname": "",
            "role": "Vereinsf\u00fchrer"
        },
        "recipient": {
            "forename": "",
            "familyname": "",
            "role": "",
            "position": ""
        },
        "mentioned_persons": [
            {
                "forename": "Eduard",
                "familyname": "Asal",
                "role": "S\u00e4nger",
                "position": ""
            }
        ],
        "mentioned_organization": [
            {
                "Organization_name": "M\u00e4nnerchor Murg/Baden",
                "place_name": "Murg/Baden"
            },
            {
                "Organization_name": "Bundesamt des Bad.S\u00e4ngerbundes",
                "place_name": ""
            }
        ],
        "mentioned_events": [
            {
                "date": "",
                "description": "Ehrungsantrag f\u00fcr S\u00e4ngerjahre"
            }
        ],
        "creation_dates": [
            {
                "day": "19",
                "month": "September",
                "year": "1941"
            }
        ],
        "creation_place": [
            "Murg/Baden"
        ],
        "mentioned_dates": [
            {
                "day": "",
                "month": "",
                "year": ""
            }
        ],
        "mentioned_places": [
            "Murg/Baden"
        ]
    },
    "content_tags": [
        "Ehrung",
        "S\u00e4ngerbund",
        "S\u00e4ngerjahre"
    ],
    "content_transcription": "Abschrift!\nEhrungs-Antrag\nDer M\u00e4nnerchor Murg/Baden\nin Murg/Baden\nbeantragt hiermit\nSt\u00fcck Ehrenurkunde f\u00fcr 40 S\u00e4ngerjahre\nSilberne Ehrennadel f\u00fcr 25 S\u00e4ngerjahre\nGoldene Ehrennadel f\u00fcr 50 S\u00e4ngerjahre\nEhrenbrief des D.S.B. f\u00fcr 50 S\u00e4ngerjahre\nEhrenbrief des D.S.B. f\u00fcr 50, 75, 100j\u00e4hriges Bestehen des Vereins.\nEhrenzeichen f\u00fcr leitende Amtswalter.\n\nZuname, Vorname Beruf Aktive S\u00e4ngerzeit in welchen Vereinen? Heute noch S\u00e4nger?\nAsal Eduard Seit 40 Jahren bis heute aktiver S\u00e4nger unseres Vereins.\n\nDie Nadel wird gew\u00fcnscht so bald wie m\u00f6glich\nF\u00fcr die Richtigkeit vorstehender Angaben haftet der unterzeichnete Vereinsf\u00fchrer.\n\nMurg/Baden, dem 19. September 1941.\nDer Kreisf\u00fchrer: Der Vereinsf\u00fchrer:\n\nAn das Bundesamt des Bad.S\u00e4ngerbundes.",
    "document_type_options": [
        "Brief"
    ],
    "document_format_options": [
        "Maschinell",
        "mitUnterschrift"
    ]
}