{
    "page_id": "Akte_083_S003",
    "metadata": {
        "author": {
            "forename": "",
            "familyname": "",
            "role": ""
        },
        "recipient": {
            "forename": "",
            "familyname": "",
            "role": "",
            "position": ""
        },
        "mentioned_persons": [
            {
                "forename": "Josef",
                "familyname": "Lauber",
                "role": "",
                "position": ""
            },
            {
                "forename": "Alfred",
                "familyname": "Joos",
                "role": "",
                "position": ""
            },
            {
                "forename": "Her.",
                "familyname": "Baumgartner",
                "role": "",
                "position": ""
            },
            {
                "forename": "Engelb.",
                "familyname": "Eckert",
                "role": "",
                "position": ""
            },
            {
                "forename": "Eugen",
                "familyname": "Schell",
                "role": "",
                "position": ""
            },
            {
                "forename": "Paul",
                "familyname": "Malzacher",
                "role": "",
                "position": ""
            }
        ],
        "mentioned_organization": [
            {
                "Organization_name": "NSDAP",
                "place_name": ""
            },
            {
                "Organization_name": "Wehrmacht",
                "place_name": ""
            }
        ],
        "mentioned_events": [
            {
                "date": "1941",
                "description": "Neujahrs-Treffen"
            }
        ],
        "creation_dates": [
            {
                "day": "",
                "month": "",
                "year": "1941"
            }
        ],
        "creation_place": [
            ""
        ],
        "mentioned_dates": [
            {
                "day": "18",
                "month": "3",
                "year": "1940"
            },
            {
                "day": "26",
                "month": "1",
                "year": ""
            },
            {
                "day": "3",
                "month": "7",
                "year": ""
            },
            {
                "day": "17",
                "month": "2",
                "year": ""
            },
            {
                "day": "14",
                "month": "5",
                "year": "1939"
            }
        ],
        "mentioned_places": [
            "Rhina"
        ]
    },
    "content_tags": [
        "Maschinell"
    ],
    "content_transcription": "Kurzbericht f\u00fcr das Neujahrs-Treffen 1941.\n\n1.) Zusammentritte des Chors:\n   Proben\n   3 interne (Generalvers., Neujahrstreffen, Bier-u.Bretzel-Ab.\n   4 St\u00e4ndchen (Burger, Sch\u00e4cher, D\u00f6bele, Binkert)\n   4 Kundgebungen 2 x NSDAP, 1 x Gemeinde-Konz., 1x VdAD)\n   3 Beerdigungen (Lauber, Joos, Baumgartner/Eckert nicht\n   weil nur 9 Jahre)\n   5 Vorstandssitzungen\n   1 Kreissitzung (Vereinsf\u00fchrer u. Chorleiter)\n\n2.) Mitglieder-Stand am 31.Dez.1940.\n   Aktive:\n   46 Mann, davon 16 z.Zt. bei der Wehrmacht.\n   30 Mann Rest /Burger, Preiser, \n   H\u00fcntelel, Helling, Kornelli nicht WH\n   Baumgartner Alfred.\n\n   Passive:\n   58 Mann, davon 7 z.Zt. bei Wehrmacht.\n\n   Abg\u00e4nge 1940:\n   a) durch Tod:\n   Lauber Josef gest. 18.3.1940 Aktiv\n   Joos Alfred \" 26.1. \" Passiv 20 Jahre\n   Baumgartner Her.\" 3.7. \" 15 \"\n   Eckert Engelb. \" 17.2. \" 9 \"\n   (Tode des Krieges)\n\n   b) Austritte:\n   1 Mann (Schell Eugen Rhina /Passiv)\n\n   Zug\u00e4nge:\n   1940 keine\n   1941 1 Aktiv /Holzapfel u. 1 Passiv HilbertA.\n   Malzacher Paul. am 14.Mai 1939 im Radio.\n\n   Lied !",
    "document_type_options": [
        "Protokoll"
    ],
    "document_format_options": [
        "Maschinell"
    ]
}