{
    "page_id": "Akte_071_S001",
    "metadata": {
        "author": {
            "forename": "",
            "familyname": "Zimmermann",
            "role": "Vereinsf\u00fchrer"
        },
        "recipient": {
            "forename": "",
            "familyname": "Mutter",
            "role": "Prokurist",
            "position": ""
        },
        "mentioned_persons": [],
        "mentioned_organization": [
            {
                "Organization_name": "Firma Schlageter",
                "place_name": "Murg"
            }
        ],
        "mentioned_events": [],
        "creation_dates": [
            {
                "day": "27",
                "month": "Oktober",
                "year": "1941"
            }
        ],
        "creation_place": [
            "Murg/Baden"
        ],
        "mentioned_dates": [],
        "mentioned_places": [
            "Schachen",
            "Amt Waldshut"
        ]
    },
    "content_tags": [
        "Maschinell",
        "mitUnterschrift"
    ],
    "content_transcription": "Murg/Baden, den 27.Oktober 1941.\n\nHerrn\nProkurist Mutter,\nSchachen\nAmt Waldshut\n\nLieber Sangesbruder Mutter!\n\nSchon beim \u00d6ffnen dieses Briefes konnten Sie sich gewiss denken, welchem Zweck er dient. Deshalb will ich auch gleich, wie man so sagt, mit der T\u00fcre ins Haus fallen.\n\nW\u00fcrden Sie so gut sein und uns wieder 40 Pakete Stumpen zu Weihnachten \u00fcber die Firma Schlageter in Murg zukommen lassen. Ich w\u00e4re Ihnen wirklich dankbar daf\u00fcr. Es ist so schwer den im Felde stehenden S\u00e4ngern ein Christkindchen zu schicken, weil man nicht wei\u00df, mit was man die Feldop\u00e4ckchen f\u00fcllen soll. Und doch haben es unsere S\u00e4ngerkameraden wirklich verdient, dass man sich gerade zum Weihnachtsfest ihrer besonders aufmerksam erinnert. Sie nehmen mir daher eine grosse Sorge ab, wenn Sie meiner Bitte entsprechen. Ich bin \u00fcberzeugt, man wird Sie von gar manch anderer Seite in der gleichen Sache angehen. Deshalb trage ich schon heute meinen Wunsch vor.\n\nMit S\u00e4ngergr\u00fcssen und Heil Hitler!\n\nDer Vereinsf\u00fchrer:\n\n(Zimmermann)",
    "document_type_options": [
        "Brief"
    ],
    "document_format_options": [
        "Maschinell",
        "mitUnterschrift"
    ]
}