{
    "page_id": "Akte_090_S001",
    "metadata": {
        "author": {
            "forename": "",
            "familyname": "Zimmermann",
            "role": "Vereinsf\u00fchrer"
        },
        "recipient": {
            "forename": "",
            "familyname": "Mutter",
            "role": "Prokurist",
            "position": ""
        },
        "mentioned_persons": [
            {
                "forename": "",
                "familyname": "Binkert",
                "role": "",
                "position": ""
            }
        ],
        "mentioned_organization": [
            {
                "Organization_name": "Schlageter",
                "place_name": "Murg"
            }
        ],
        "mentioned_events": [
            {
                "date": "",
                "description": "Rauchwarenlieferung von 200 Stumpen"
            }
        ],
        "creation_dates": [
            {
                "day": "16",
                "month": "Dezember",
                "year": "1940"
            }
        ],
        "creation_place": [
            "Murg"
        ],
        "mentioned_dates": [
            {
                "day": "",
                "month": "",
                "year": ""
            }
        ],
        "mentioned_places": [
            "Schachen",
            "Amt Waldshut"
        ]
    },
    "content_tags": [
        "Maschinell",
        "mitUnterschrift"
    ],
    "content_transcription": "Murg, den 16. Dezember 1940.\n\nHerrn\nProkurist Mutter\nSchachen/ Amt Waldshut\n\nLieber Sangesbruder Mutter!\n\nWir haben uns gefreut dar\u00fcber, wie uns das Rauchwarengesch\u00e4ft Schlageter in Murg die Mitteilung machte, dass Sie ihm f\u00fcr uns 200 Stumpen zukommen liessen, um die wir Sie durch Herrn Binkert gebeten hatten. Ich kann mir vorstellen, von wieviel Seiten Sie gegenw\u00e4rtig um Rauchwaren angegangen werden. Umso h\u00f6her wissen wir Ihr Entgegenkommen einzusch\u00e4tzen.\n\nLassen Sie mich im Namen des Chors, vor allem aber im Namen unserer S\u00e4ngersoldaten, die ja die Pakete erhalten, f\u00fcr Ihr Wohlwollen herzlich Dank sagen, das Sie schon so oft unter Beweis stellten, wenn es galt, im Dienste unseres gemeinsamen Ideals ein Opfer zu bringen oder eine Gef\u00e4lligkeit zu erweisen.\n\nMit herzlichen S\u00e4ngergr\u00fcssen und\n\nHeil Hitler!\n\nDer Vereinsf\u00fchrer:\n\n(Zimmermann)",
    "document_type_options": [
        "Brief"
    ],
    "document_format_options": [
        "Maschinell",
        "mitUnterschrift"
    ]
}