{
    "page_id": "Akte_085_S001",
    "metadata": {
        "author": {
            "forename": "",
            "familyname": "",
            "role": "Vereinsf\u00fchrer"
        },
        "recipient": {
            "forename": "Karl",
            "familyname": "Preiser",
            "role": "",
            "position": ""
        },
        "mentioned_persons": [],
        "mentioned_organization": [
            {
                "Organization_name": "M\u00e4nnerchor",
                "place_name": ""
            }
        ],
        "mentioned_events": [
            {
                "date": "1. Januar 1941",
                "description": "Neujahrs-Treffen"
            }
        ],
        "creation_dates": [
            {
                "day": "31",
                "month": "Dezember",
                "year": "1940"
            }
        ],
        "creation_place": [
            "Murg"
        ],
        "mentioned_dates": [
            {
                "day": "1",
                "month": "Januar",
                "year": "1941"
            }
        ],
        "mentioned_places": [
            "Waldshut",
            "Murgtal-Nebenzimmer"
        ]
    },
    "content_tags": [
        "Maschinell"
    ],
    "content_transcription": "Murg, den 31. Dezember 1940.\n\nHerrn\nKarl Preiser,\nMurg.\n\nLieber Sangesbruder Preiser!\n\nIch komme zur\u00fcck auf unsere letzte Unterredung in Waldshut und m\u00f6chte Sie auf diesem Wege nochmals einladen\n\nmorgen, Mittwoch, den 1. Januar 1941\nabends 8 Uhr im Murgtal-Nebenzimmer\n\nan unserem Neujahrs-Treffen teilzunehmen und damit den Reigen einer weiteren aktiven Teilnahme an unserem Vereinsleben wieder fortzusetzen.\n\nVergessen Sie die Angelegenheit, die Sie in den letzten Monaten leider von uns fernhielt. Der M\u00e4nnerchor tr\u00e4gt ganz bestimmt keine Schuld daran und es ist deshalb sicher nicht recht, wenn Sie ihn das f\u00fchlen lassen.\n\nAlso bitte tun Sie mir den Gefallen und kommen Sie. Sie sind herzlich eingeladen.\n\nHeil Hitler!\n\nDer Vereinsf\u00fchrer:",
    "document_type_options": [
        "Brief"
    ],
    "document_format_options": [
        "Maschinell"
    ]
}