{
    "page_id": "Akte_073_S001",
    "metadata": {
        "author": {
            "forename": "",
            "familyname": "Zimmermann",
            "role": "Vereinsf\u00fchrer"
        },
        "recipient": {
            "forename": "",
            "familyname": "",
            "role": "M\u00e4nner-Gesangverein",
            "position": "Neustadt/Schwarzwald"
        },
        "mentioned_persons": [
            {
                "forename": "",
                "familyname": "",
                "role": "Ehrenvorsitzender",
                "position": ""
            }
        ],
        "mentioned_organization": [
            {
                "Organization_name": "M\u00e4nnerchor",
                "place_name": "Murg/Baden"
            }
        ],
        "mentioned_events": [
            {
                "date": "Sommer 1939",
                "description": "S\u00e4ngerreise und Liedertag"
            }
        ],
        "creation_dates": [
            {
                "day": "19",
                "month": "September",
                "year": "1941"
            }
        ],
        "creation_place": [
            "Murg/Baden"
        ],
        "mentioned_dates": [
            {
                "day": "",
                "month": "",
                "year": "1939"
            }
        ],
        "mentioned_places": [
            "Neustadt/Schwarzwald"
        ]
    },
    "content_tags": [
        "Maschinell",
        "mitUnterschrift"
    ],
    "content_transcription": "Murg/Baden, den 19.September 1941.\n\nAn den\nM\u00e4nner-Gesangverein\nNeustadt/Schwarzwald.\n\nIm Sommer 1939 nahm unser Verein auf einer S\u00e4ngerreise in Ihrem St\u00e4dtchen einen kurzen Aufenthalt. Es war an jenem Sonntag gerade Liedertag und Sie trugen aus diesem Anlass vor dem Rathaus einige Lieder vor. Dabei kamen wir mit Ihnen erfreulicherweise in Ber\u00fchrung. Bei unserem Abschied sangen Sie dann an unserem Auto ein Lied, das uns allen recht gut gefiel. Es war darin von Widerschein die\u00dfg Rede. Ganz besonders hat unser Ehrenvorsitzender daran gefallen und er m\u00f6chte das betreffende Lied unserem Chor deshalb gerne stiften. Leider kennen wir aber den Titel nicht.\n\nVielleicht k\u00f6nnen Sie noch herausbringen, was f\u00fcr ein Schlusslied Sie uns damals gesungen haben. Gerne erwarte ich Ihren Bescheid, f\u00fcr den ich zum Voraus danke. R\u00fcckporto f\u00fcge ich bei.\n\nSollten wir seinerzeit am dortigen Rathaus nicht mit Ihnen zusammengetroffen sein, sondern mit einem evt. bestehenden zweiten M\u00e4nnerchor, dann darf ich bitten, meinen Brief zur Erledigung an diesen weiterzugeben.\n\nMit freundlichen S\u00e4ngergr\u00fcssen und\n\nHeil Hitler!\nDer Vereinsf\u00fchrer:\n\n(Zimmermann)",
    "document_type_options": [
        "Brief"
    ],
    "document_format_options": [
        "Maschinell",
        "mitUnterschrift"
    ]
}