{
    "page_id": "Akte_084_S001",
    "metadata": {
        "author": {
            "forename": "",
            "familyname": "",
            "role": "Vereinsf\u00fchrer"
        },
        "recipient": {
            "forename": "Paul",
            "familyname": "Malzacher",
            "role": "",
            "position": ""
        },
        "mentioned_persons": [
            {
                "forename": "",
                "familyname": "Habig",
                "role": "Chorleiter",
                "position": ""
            }
        ],
        "mentioned_organization": [
            {
                "Organization_name": "Gesangverein",
                "place_name": "Laufenburg"
            }
        ],
        "mentioned_events": [
            {
                "date": "1941-01-01",
                "description": "Neujahrstreffen"
            }
        ],
        "creation_dates": [
            {
                "day": "31",
                "month": "12",
                "year": "1940"
            }
        ],
        "creation_place": [
            "Murg"
        ],
        "mentioned_dates": [
            {
                "day": "1",
                "month": "1",
                "year": "1941"
            }
        ],
        "mentioned_places": [
            "Murgtal"
        ]
    },
    "content_tags": [
        "Maschinell"
    ],
    "content_transcription": "Murg, den 31. Dezember 1940.\n\nHerrn\nPaul Malzacher\nMurg\n\nLieber Sangesbruder Paul!\n\nDarf ich Dich so anreden. Ich hoffe bestimmt, denn ich weiss, Du bist auch jetzt noch ein Freund unserer Sache.\nChorleiter Habig hat mich schon vor l\u00e4ngerer Zeit \u00fcber Deine R\u00fcckkehr in die Heimat orientiert. Und nun ist es, wie ich h\u00f6re, Wirklichkeit geworden. Daher m\u00f6chte ich mich beeilen und Dich einladen, wieder aktiv in unsere Reihen einzutreten. Du warst von jeher ein begeisterter Anh\u00e4nger des Liedes. Wir S\u00e4nger w\u00fcrden uns deshalb freuen, Dich wieder bei uns zu wissen. Morgen, Mittwoch den 1. Januar, haben wir abends 8 Uhr im Murgtal-Nebenzimmer das traditionell gewordene Neujahrstreffen, bei dem diesmal auch der Gesangverein Laufenburg anwesend sein wird. Dieser Anlass w\u00e4re mir eine willkommene Gelegenheit unseren lb. Paul begr\u00fcssen zu k\u00f6nnen.\n\nGib also Deinem Herzen einen Stoss und komme morgen Abend ins Murgtal. Du bist freundlich eingeladen.\n\nHeil Hitler!\nDer Vereinsf\u00fchrer:",
    "document_type_options": [
        "Brief"
    ],
    "document_format_options": [
        "Maschinell"
    ]
}