{
    "page_id": "Akte_070_S001",
    "metadata": {
        "author": {
            "forename": "",
            "familyname": "",
            "role": "Vereinsf\u00fchrer"
        },
        "recipient": {
            "forename": "Jakob",
            "familyname": "K\u00fcpfer",
            "role": "",
            "position": ""
        },
        "mentioned_persons": [
            {
                "forename": "",
                "familyname": "",
                "role": "",
                "position": ""
            }
        ],
        "mentioned_organization": [
            {
                "Organization_name": "M\u00e4nnerchor",
                "place_name": "Murg"
            }
        ],
        "mentioned_events": [
            {
                "date": "24. Oktober",
                "description": "Brief von Jakob K\u00fcpfer"
            }
        ],
        "creation_dates": [
            {
                "day": "27",
                "month": "Oktober",
                "year": "1941"
            }
        ],
        "creation_place": [
            "Rhina"
        ],
        "mentioned_dates": [
            {
                "day": "24",
                "month": "Oktober",
                "year": ""
            }
        ],
        "mentioned_places": [
            "Murg",
            "Baden"
        ]
    },
    "content_tags": [
        "Maschinell",
        "mitUnterschrift"
    ],
    "content_transcription": "Rhina, den 27. Oktober 1941.\n\nHerrn\nJakob K\u00fcpfer\n\"zum Meyerhof\"\nMurg/Baden.\n\nLieber Herr K\u00fcpfer!\n\nAls ich am Samstag Abend von einer Gesch\u00e4ftsreise nach Hause kam, sagte mir meine Frau, dass Sie mich besuchen wollten und gab mir gleichzeitig Ihr Brief vom 24. d.M.\n\nW\u00e4hrend meiner Amtst\u00e4tigkeit als M\u00e4nnerchor F\u00fchrer habe ich schon so oft Ihr offenes Herz f\u00fcr unsere S\u00e4ngersache kennen gelernt. Ich weiss, dass keiner mehr wie Sie unsere Opfer um das deutsche Lied achtet und sch\u00e4tzt. Dies stellen Sie nun wieder erneut unter Beweis. Schon seit einiger Zeit besch\u00e4ftige ich mich mit dem Gedanken, wie wir unseren Kameraden im Felde zu Weihnachten, dem Fest der Liebe und des Gebens, eine Freude machen k\u00f6nnen, welche die Soldaten, wie Sie richtig schrieben, wirklich verdienen. Erst vor zwei Wochen habe ich die S\u00e4nger um Unterst\u00fctzung beim Zustandekommen der Feldpost-P\u00e4ckchen gebeten. Nun nehmen Sie mir mit Ihrer hochherzigen Spende von RM. 100.-- alle Sorge ab.\n\nIm Namen des Chors hiermit meinen aufrichtigen Dank. Ich werde die Vorstandschaft sowie den Verein \u00fcber Ihre edle Handlungsweise am kommenden Donnerstag orientieren und das Geld dem gedachten Zweck zuf\u00fchren.\n\nMit herzlichem S\u00e4ngergruss und\n\nHeil Hitler!\n\nDer Vereinsf\u00fchrer:",
    "document_type_options": [
        "Brief"
    ],
    "document_format_options": [
        "Maschinell",
        "mitUnterschrift"
    ]
}