{
    "page_id": "Akte_089_S001",
    "metadata": {
        "author": {
            "forename": "Heil",
            "familyname": "Hitler",
            "role": ""
        },
        "recipient": {
            "forename": "Eduard",
            "familyname": "",
            "role": "",
            "position": ""
        },
        "mentioned_persons": [
            {
                "forename": "Habig",
                "familyname": "",
                "role": "Chorleiter",
                "position": ""
            },
            {
                "forename": "Suter",
                "familyname": "",
                "role": "Ehrenpr\u00e4sident",
                "position": ""
            },
            {
                "forename": "Otto",
                "familyname": "L\u00fcthy",
                "role": "",
                "position": ""
            },
            {
                "forename": "Binkert",
                "familyname": "Jr.",
                "role": "",
                "position": ""
            },
            {
                "forename": "Ganter",
                "familyname": "",
                "role": "",
                "position": ""
            },
            {
                "forename": "Ernst",
                "familyname": "D\u00f6bele",
                "role": "Sangesbruder",
                "position": ""
            }
        ],
        "mentioned_organization": [
            {
                "Organization_name": "Laufenburger Verein",
                "place_name": ""
            }
        ],
        "mentioned_events": [
            {
                "date": "31.12.40",
                "description": "Kasse abschlie\u00dfen"
            }
        ],
        "creation_dates": [
            {
                "day": "16",
                "month": "12",
                "year": "1940"
            }
        ],
        "creation_place": [
            "Rhina"
        ],
        "mentioned_dates": [
            {
                "day": "",
                "month": "",
                "year": ""
            }
        ],
        "mentioned_places": [
            ""
        ]
    },
    "content_tags": [
        "Maschinell",
        "mitUnterschrift"
    ],
    "content_transcription": "Rhina, den 16. Dezember 1940.\n\nLieber Eduard!\n\nIch habe Dir am letzten Donnerstag schon gesagt, dass ich am n\u00e4chsten Donnerstag wegen dienstlicher Abwesenheit nicht in die Singstunde kommen kann. Bitte, vertrete mich deshalb. F\u00fchre in meinem Namen folgendes durch:\n\n1.) Statte f\u00fcr die gestifteten Gaben zu unseren Soldaten-P\u00e4ckchen allen S\u00e4ngern Dank ab. Vergesse dabei nicht unseren Chorleiter Habig besonders zu erw\u00e4hnen f\u00fcr die gestifteten 16 Paar Hosentr\u00e4ger. Sage auch den Kameraden, die sich beim Herrichten der P\u00e4ckchen zur Verf\u00fcgung stellten, Dank. Hier hat sich Ehrenpr\u00e4sident Suter vor allem hervorgetan. Er holte noch die fehlenden Unterschriften, sorgte f\u00fcr Tannenreisig, kaufte die Schachteln beim Buchbinder und schaffte anderen Tags die fertigen Pakete auf die Post. Er hat mir also viel Lauferei und Arbeit abgenommen.\n\n2.) Gebe beiliegende Mk. 2.\u2014 dem Kassier; sie sind von L\u00fcthy Otto als Beitrag zu den P\u00e4ckchen.\n\n3.) Sage den S\u00e4ngern, im alten Jahr sei keine Singstunde mehr. Dagegen m\u00f6chte ich f\u00fcr den Neujahrsabend ein Treffen vorschlagen. Schau wie die Stimmung daf\u00fcr ist. Nat\u00fcrlich hat es nur Wert, wenn auch alles erscheint, denn ich m\u00f6chte bei dieser Gelegenheit 2 S\u00e4nger ehren (verrate dar\u00fcber aber nichts). Au\u00dferdem w\u00fcrde ich den Laufenburger Verein dazu einladen. N\u00e4heres \u00fcber Ort und Zeit der Zusammenkunft wird, sofern sie stattfinden soll, von mir durch Einladung noch bekanntgegeben.\n\n4.) Lass die beiden Karten von allen S\u00e4ngern unterschreiben und beauftrage den Kassier den beiden Kameraden Binkert Jr. und Ganter ihre Geburtstagsp\u00e4ckchen unter Beilage der Karten bald auf den Weg zu bringen und zwar im \u00fcblichen Wert und der \u00fcblichen Zusammensetzung.\n\n5.) Sage dem Kassier, er m\u00f6ge die Kasse zum 31.12.40 abschliessen und frage ihn, wann die Kassen-Revision stattfinden kann.\n\n6.) Zu Kassen-Revisoren bestimme ich hiermit Dich und Sangesbruder D\u00f6bele Ernst. Bitte orientiere letzteren und pr\u00fcft die Kasse m\u00f6glichst vor dem Neujahrstreffen.\n\nMit freundlichen Gr\u00fcssen\n\nHeil Hitler!",
    "document_type_options": [
        "Brief"
    ],
    "document_format_options": [
        "Maschinell",
        "mitUnterschrift"
    ]
}